{
  "meta": {
    "schemaVersion": "1.0",
    "inputId": "2026-06-11-distribution-shift-input",
    "createdAt": "2026-06-11T09:00:00Z",
    "language": "en",
    "owners": ["signal-deck"],
    "tags": ["ai", "distribution", "workflow", "product-strategy"]
  },
  "brief": {
    "topic": "AI distribution and product capture",
    "objective": "Assess where strategic value is concentrating as model quality converges.",
    "audience": "executives and operators",
    "timeHorizon": "structural",
    "deliverable": "executive briefing",
    "constraints": [
      "Prefer strategic interpretation over generic recap.",
      "Surface second-order effects early.",
      "Keep output useful under time pressure."
    ],
    "readerProfile": {
      "roles": ["software-engineer", "founder", "operator"],
      "interests": ["ai", "workflow", "product-strategy"],
      "advantageTargets": ["career-positioning", "market-interpretation"],
      "depthPreference": "deep",
      "pedagogicalPreference": "thesis-first",
      "roleWeights": {
        "software-engineer": 0.5,
        "founder": 0.3,
        "operator": 0.2
      }
    }
  },
  "sources": [
    {
      "sourceId": "src-1",
      "title": "Model vendors are racing to own the application layer",
      "sourceType": "article",
      "publisher": "Industry Analysis Weekly",
      "url": "https://example.com/model-vendors-application-layer",
      "publishedAt": "2026-06-10T13:30:00Z",
      "summary": "Product vendors are bundling AI capabilities into broader suites rather than selling isolated features."
    },
    {
      "sourceId": "src-2",
      "title": "Enterprise buyers care less about frontier prestige and more about workflow fit",
      "sourceType": "earnings-call",
      "publisher": "Public SaaS company transcript",
      "publishedAt": "2026-06-10T21:00:00Z",
      "summary": "Adoption correlates more strongly with embedded workflow value than with headline model quality."
    },
    {
      "sourceId": "src-3",
      "title": "Context, memory, and interface are emerging as sticky advantages",
      "sourceType": "research-note",
      "publisher": "Internal synthesis",
      "summary": "The winning surface may be where user context accumulates rather than where raw model quality peaks."
    }
  ],
  "signals": [
    {
      "signalId": "sig-1",
      "statement": "Distribution is carrying more strategic weight as raw model differentiation narrows.",
      "category": "distribution",
      "priority": "high",
      "sourceIds": ["src-1", "src-2"],
      "evidence": "Multiple product and buyer signals point toward packaging, workflow integration, and reach becoming more decisive than standalone model access.",
      "implications": [
        "Owning the user relationship becomes economically more important.",
        "Go-to-market strength can compound technical capability rather than merely follow it."
      ],
      "counterpoints": [
        "Frontier model gaps can still matter in narrow, high-stakes domains."
      ]
    },
    {
      "signalId": "sig-2",
      "statement": "Context capture is emerging as the scarcer asset than inference alone.",
      "category": "workflow",
      "priority": "high",
      "sourceIds": ["src-2", "src-3"],
      "evidence": "Embedded systems that learn user habits and store reusable context are harder to displace than point solutions that only answer prompts.",
      "implications": [
        "Memory and workflow embedding can become part of the moat.",
        "Switching costs may rise at the interface layer rather than the model layer."
      ]
    },
    {
      "signalId": "sig-3",
      "statement": "Interface design is increasingly shaping product economics, not just usability.",
      "category": "product",
      "priority": "medium",
      "sourceIds": ["src-1", "src-3"],
      "evidence": "The interface determines what gets repeated, measured, remembered, and eventually monetized.",
      "implications": [
        "The presentation surface influences retention and monetization.",
        "UI decisions can determine where strategic capture lands."
      ],
      "notes": "This signal matters less as a headline and more as a mechanism behind the broader shift."
    }
  ],
  "synthesis": {
    "workingThesis": "As raw model capability converges, the battle for value is moving up the stack toward workflow ownership, context capture, and distribution.",
    "supportingThemes": [
      "distribution is becoming a moat",
      "workflow control is a strategic surface",
      "context accumulates where users return daily"
    ],
    "openQuestions": [
      "Which layer keeps the recurring user relationship as model access broadens?",
      "Where will the most valuable non-portable context accumulate?"
    ],
    "contradictions": [
      "Some categories will still reward raw model leadership more than distribution depth."
    ],
    "missingInformation": [
      "A stronger set of examples from vertical software categories would improve confidence in the workflow thesis."
    ]
  },
  "editorialDecisions": {
    "heroFrame": "The strategic fight is shifting from who has the best model to who owns the workflow around it.",
    "topLineThesis": "Distribution is becoming as important as the model.",
    "radarOrder": ["sig-1", "sig-2", "sig-3"],
    "deepDiveSignalIds": ["sig-1", "sig-2", "sig-3"],
    "marketMapFrames": ["Winners", "Pressured", "Opportunity"],
    "watchlistSeeds": [
      "Which layer captures the recurring user relationship?",
      "What kinds of context become least portable over time?",
      "Which products turn occasional use into operational dependency?"
    ],
    "dominantPedagogicalFunction": "strategy-lesson",
    "readerTranslationLenses": ["software-engineer", "founder", "operator"]
  }
}
